{
  "$schema": "../../schema/listing.schema.json",
  "slug": "nuclear-fallout",
  "name": "Nuclear Fallout",
  "tagline": "A calm, glowing trefoil. Right up until somebody breaks the build.",
  "description": "It sits on your desktop minding its own business: green while everything passes, yellow while a pull request wants you, pulsing while a build runs. Then a pipeline breaks and it goes off. White flash, fireball, shock wave, mushroom cloud, the works. Proportionate? No. Satisfying? Very. When the dust settles a small red trefoil keeps glowing until someone cleans up the fallout. With no Greenlight running it goes grey. Move it, resize it, and crank the glow if your desk needs more drama.",
  "author": {
    "name": "The Meddling Idiot"
  },
  "repository": "https://github.com/meddlingidiot/MeddlingIdiot.Greenlight.FalloutClient",
  "license": "MIT",
  "platforms": [
    "windows"
  ],
  "language": "C#",
  "integration": "sdk",
  "greenlight-api": 1,
  "build-time": "an evening",
  "assets": {
    "poster": "poster.jpg",
    "clip": "clip.mp4",
    "attestation": "original"
  },
  "last-verified": {
    "date": "2026-09-19",
    "greenlight": "1.0.23",
    "sdk": "1.2.0"
  },
  "maintained": true
}
