{
  "$schema": "../../schema/listing.schema.json",
  "slug": "wallpaper",
  "name": "Wallpaper",
  "tagline": "Your entire desktop, turned the colour of your build. Subtle, it is not.",
  "description": "Green when everything passes, amber when a pull request wants you, red when a pipeline breaks, grey when Greenlight isn't running. Four pictures and that's your lot. It ignores builds starting, because a wallpaper that changed on every push wouldn't be a status light, it would be a strobe, and nobody wants that. It's also the one client that borrows something of yours, so it saves your real wallpaper to disk first and puts it back when you quit. Your cat photo is safe.",
  "author": {
    "name": "The Meddling Idiot"
  },
  "repository": "https://github.com/meddlingidiot/MeddlingIdiot.Greenlight.WallpaperClient",
  "license": "MIT",
  "platforms": [
    "windows"
  ],
  "language": "C#",
  "integration": "sdk",
  "greenlight-api": 1,
  "build-time": "an evening",
  "assets": {
    "poster": "poster.jpg",
    "clip": "clip.mp4",
    "attestation": "original"
  },
  "last-verified": {
    "date": "2026-09-19",
    "greenlight": "1.0.23",
    "sdk": "1.2.0"
  },
  "maintained": true
}
