{
  "$schema": "../../schema/listing.schema.json",
  "slug": "edge-light",
  "name": "EdgeLight",
  "tagline": "Two pixels of build status. We'd apologise for the excess, but there isn't any.",
  "description": "Other clients get cars, swords and explosions. This one gets a line. One to five pixels along any edge of your screen, green while everything passes, amber while a pull request sulks, breathing gently while a build runs. No window, no clicks, no desk space, no personality. You'll forget it's there, which is the point. Only a broken build earns a little drama: an old rotating hazard light slides out of the edge and spins until someone fixes it. Too much? Switch it off and enjoy your line.",
  "author": {
    "name": "The Meddling Idiot"
  },
  "repository": "https://github.com/meddlingidiot/MeddlingIdiot.Greenlight.EdgeLightClient",
  "license": "MIT",
  "platforms": [
    "windows"
  ],
  "language": "C#",
  "integration": "sdk",
  "greenlight-api": 1,
  "build-time": "an evening",
  "assets": {
    "poster": "poster.jpg",
    "clip": "clip.mp4",
    "attestation": "original"
  },
  "last-verified": {
    "date": "2026-09-19",
    "greenlight": "1.0.23",
    "sdk": "1.2.0"
  },
  "maintained": true
}
